{
  "schema_version": 1,
  "case_id": "gemini-to-gemini-json",
  "cell": {"entry_protocol": "gemini", "provider_protocol": "gemini", "transport": "json", "mode": "direct"},
  "client_request": {
    "method": "POST",
    "path": "/v1beta/models/mock.gemini-model:generateContent",
    "headers": {"content-type": "application/json"},
    "body": {"contents": [{"role": "user", "parts": [{"text": "hello"}]}], "generationConfig": {"maxOutputTokens": 64}}
  },
  "expected_provider": {
    "paths": ["/v1beta/models/gemini-model:generateContent"],
    "method": "POST",
    "auth_required": true,
    "body_must": {"contents.0.role": "user", "contents.0.parts.0.text": "hello"},
    "body_must_not": ["routecodex_internal", "metadata_center", "debug_snapshot"],
    "exact": null
  },
  "upstream_response": {
    "protocol": "gemini",
    "mode": "json",
    "status": 200,
    "content_type": "application/json",
    "body": {"candidates": [{"content": {"role": "model", "parts": [{"text": "ok"}]}, "finishReason": "STOP"}], "usageMetadata": {"promptTokenCount": 7, "candidatesTokenCount": 2, "totalTokenCount": 9}}
  },
  "expected_client": {
    "transport": "complete",
    "status": 200,
    "body_must": {"candidates.0.content.parts.0.text": "ok", "candidates.0.finishReason": "STOP", "usageMetadata.promptTokenCount": 7},
    "body_must_not": ["provider_error", "internal_error", "routecodex_internal", "metadata_center"],
    "semantic_terminal_required": true
  },
  "assertions": {"provider_attempt_count": 1, "probe_attempts_may_occur": true, "no_control_leakage": true},
  "source": {
    "sha": "bfaedf18301d02a423bd5422d22e41432d231ab8",
    "files": ["internal/gateway/gemini_function_parts_test.go"],
    "tests": ["internal/gateway/gemini_function_parts_test.go::TestGeminiFunctionResponseImageReachesUpstream"],
    "adaptation": "Direct Gemini generateContent with the fixed protocol shape."
  },
  "contract_differences": []
}
