{
  "schema_version": 1,
  "case_id": "responses-to-chat-json",
  "cell": {"entry_protocol": "responses", "provider_protocol": "openai_chat", "transport": "json", "mode": "relay"},
  "client_request": {
    "method": "POST",
    "path": "/v1/responses",
    "headers": {"content-type": "application/json"},
    "body": {"model": "mock.chat-model", "instructions": "be brief", "input": [{"role": "user", "content": [{"type": "input_text", "text": "hello"}]}], "max_output_tokens": 64, "stream": false}
  },
  "expected_provider": {
    "paths": ["/v1/chat/completions"],
    "method": "POST",
    "auth_required": true,
    "body_must": {"model": "chat-model", "messages.0.role": "system", "messages.1.content": "hello", "stream": false},
    "body_must_not": ["routecodex_internal", "metadata_center", "debug_snapshot"],
    "exact": null
  },
  "upstream_response": {
    "protocol": "openai_chat",
    "mode": "json",
    "status": 200,
    "content_type": "application/json",
    "body": {"id": "chatcmpl_responses_to_chat_json", "object": "chat.completion", "choices": [{"index": 0, "message": {"role": "assistant", "content": "ok"}, "finish_reason": "stop"}], "usage": {"prompt_tokens": 7, "completion_tokens": 2, "total_tokens": 9}}
  },
  "expected_client": {
    "transport": "complete",
    "status": 200,
    "body_must": {"output.0.content.0.text": "ok", "status": "completed"},
    "body_must_not": ["provider_error", "internal_error", "routecodex_internal", "metadata_center"],
    "semantic_terminal_required": true
  },
  "assertions": {"provider_attempt_count": 1, "probe_attempts_may_occur": true, "no_control_leakage": true},
  "source": {
    "sha": "bfaedf18301d02a423bd5422d22e41432d231ab8",
    "files": ["internal/gateway/testdata/upstream_bodies/responses-to-chat.json"],
    "tests": ["internal/gateway/translate_stream_test.go::TestChatTranslationUsageBeforeUnindexedChoice"],
    "adaptation": "Fixed Responses input; expected Chat wire and Responses client semantics come from the protocols."
  },
  "contract_differences": []
}
