{
  "schema_version": 1,
  "case_id": "gemini-native-declaration-schema-relay-json",
  "cell": {"entry_protocol": "gemini", "provider_protocol": "gemini", "transport": "json", "mode": "relay"},
  "client_request": {
    "method": "POST",
    "path": "/v1beta/models/gemini-client/generateContent",
    "headers": {"content-type": "application/json"},
    "body": {
      "cachedContent": "caches/schema-dc83ed6",
      "contents": [{"role": "user", "parts": [{"text": "use echo once"}]}],
      "tools": [{"functionDeclarations": [{
        "name": "echo",
        "description": "declared schema tool echo",
        "parametersJsonSchema": {
          "type": "object",
          "$defs": {"text": {"type": "string", "description": "echoed message"}},
          "properties": {"text": {"$ref": "#/$defs/text"}},
          "required": ["text"]
        },
        "responseJsonSchema": {
          "type": "object",
          "properties": {"ok": {"type": "boolean"}}
        },
        "behavior": "NON_BLOCKING"
      }]}]
    }
  },
  "expected_provider": {
    "paths": ["/v1beta/models/gemini-wire:generateContent"],
    "method": "POST",
    "auth_required": true,
    "body_must_not": ["routecodex_internal", "metadata_center", "debug_snapshot", "gemini_native_fields", "routecodex_chat_extension", "messages", "tool_choice"],
    "exact": {
      "cachedContent": "caches/schema-dc83ed6",
      "contents": [{"role": "user", "parts": [{"text": "use echo once"}]}],
      "tools": [{"functionDeclarations": [{
        "name": "echo",
        "description": "declared schema tool echo",
        "parametersJsonSchema": {
          "type": "object",
          "$defs": {"text": {"type": "string", "description": "echoed message"}},
          "properties": {"text": {"$ref": "#/$defs/text"}},
          "required": ["text"]
        },
        "responseJsonSchema": {
          "type": "object",
          "properties": {"ok": {"type": "boolean"}}
        },
        "behavior": "NON_BLOCKING"
      }]}]
    }
  },
  "upstream_response": {
    "protocol": "gemini",
    "mode": "json",
    "status": 200,
    "content_type": "application/json",
    "body": {
      "candidates": [{
        "index": 0,
        "finishReason": "STOP",
        "content": {"role": "model", "parts": [{
          "functionCall": {"id": "call_schema_1", "name": "echo", "args": {"text": "native-tool-result"}}
        }]}
      }],
      "usageMetadata": {"promptTokenCount": 3, "candidatesTokenCount": 2, "totalTokenCount": 5}
    }
  },
  "expected_client": {
    "transport": "complete",
    "status": 200,
    "body_must": {
      "candidates.0.content.parts.0.functionCall.name": "echo",
      "candidates.0.content.parts.0.functionCall.id": "call_schema_1",
      "candidates.0.content.parts.0.functionCall.args.text": "native-tool-result",
      "candidates.0.finishReason": "STOP"
    },
    "body_must_not": ["provider_error", "internal_error", "routecodex_internal", "metadata_center"],
    "semantic_terminal_required": true
  },
  "assertions": {"provider_attempt_count": 1, "probe_attempts_may_occur": true, "no_control_leakage": true},
  "runtime_setup": {
    "provider_id": "mock-gemini",
    "model": "gemini-client",
    "wire_model": "gemini-wire",
    "candidate_ids": ["mock-gemini/gemini-client"]
  },
  "source": {
    "sha": "bfaedf18301d02a423bd5422d22e41432d231ab8",
    "files": [],
    "tests": [],
    "adaptation": "Independent RCC public-entry regression for issue dc83ed6. The expected native declaration is written as a literal JSON-Schema oracle; the existing bounded echo consumer is reused for the client-side tool execution and paired follow-up, so the case does not depend on the proxy-side codec."
  },
  "contract_differences": [
    {
      "source_behavior": "The native Gemini request carries a JSON-Schema-only functionDeclarations entry with $defs/$ref and the complementary responseJsonSchema/behavior siblings.",
      "rcc_requirement": "The first provider POST must preserve parametersJsonSchema and its complete $defs/$ref content plus responseJsonSchema and behavior; no Chat-shaped parameters member may be invented."
    }
  ],
  "turns": [
    {
      "turn_id": "schema-call",
      "purpose": "The provider returns the declared echo functionCall with complete arguments.",
      "expected_client_must": {
        "candidates.0.content.parts.0.functionCall.name": "echo",
        "candidates.0.content.parts.0.functionCall.id": "call_schema_1",
        "candidates.0.content.parts.0.functionCall.args.text": "native-tool-result",
        "candidates.0.finishReason": "STOP"
      }
    },
    {
      "turn_id": "schema-followup",
      "purpose": "The client executes the bounded echo consumer and submits the actual output with the paired native history.",
      "client_request": {
        "method": "POST",
        "path": "/v1beta/models/gemini-client/generateContent",
        "headers": {"content-type": "application/json"},
        "body": {
          "cachedContent": "caches/schema-dc83ed6",
          "contents": [
            {"role": "user", "parts": [{"text": "use echo once"}]},
            {"role": "model", "parts": [{"functionCall": {"id": "call_schema_1", "name": "echo", "args": {"text": "native-tool-result"}}}]},
            {"role": "user", "parts": [{"functionResponse": {"id": "call_schema_1", "name": "echo", "response": {"output": "native-tool-result"}}}]}
          ],
          "tools": [{"functionDeclarations": [{
            "name": "echo",
            "description": "declared schema tool echo",
            "parametersJsonSchema": {
              "type": "object",
              "$defs": {"text": {"type": "string", "description": "echoed message"}},
              "properties": {"text": {"$ref": "#/$defs/text"}},
              "required": ["text"]
            },
            "responseJsonSchema": {
              "type": "object",
              "properties": {"ok": {"type": "boolean"}}
            },
            "behavior": "NON_BLOCKING"
          }]}]
        }
      },
      "expected_provider_exact": {
        "cachedContent": "caches/schema-dc83ed6",
        "contents": [
          {"role": "user", "parts": [{"text": "use echo once"}]},
          {"role": "model", "parts": [{"functionCall": {"id": "call_schema_1", "name": "echo", "args": {"text": "native-tool-result"}}}]},
          {"role": "user", "parts": [{"functionResponse": {"id": "call_schema_1", "name": "echo", "response": {"output": "native-tool-result"}}}]}
        ],
        "tools": [{"functionDeclarations": [{
          "name": "echo",
          "description": "declared schema tool echo",
          "parametersJsonSchema": {
            "type": "object",
            "$defs": {"text": {"type": "string", "description": "echoed message"}},
            "properties": {"text": {"$ref": "#/$defs/text"}},
            "required": ["text"]
          },
          "responseJsonSchema": {
            "type": "object",
            "properties": {"ok": {"type": "boolean"}}
          },
          "behavior": "NON_BLOCKING"
        }]}]
      },
      "upstream_response": {
        "protocol": "gemini",
        "mode": "json",
        "status": 200,
        "content_type": "application/json",
        "body": {
          "candidates": [{
            "index": 0,
            "finishReason": "STOP",
            "content": {"role": "model", "parts": [{"text": "done"}]}
          }],
          "usageMetadata": {"promptTokenCount": 7, "candidatesTokenCount": 2, "totalTokenCount": 9}
        }
      },
      "expected_client_contract": {
        "transport": "complete",
        "status": 200,
        "body_must_not": ["provider_error", "internal_error", "routecodex_internal", "metadata_center"],
        "semantic_terminal_required": true
      },
      "expected_client_must": {
        "candidates.0.content.parts.0.text": "done",
        "candidates.0.finishReason": "STOP",
        "usageMetadata.totalTokenCount": 9
      }
    }
  ],
  "tool_followup": {
    "consumer": "echo",
    "side_effect": "none",
    "input": {"text": "native-tool-result"},
    "expected_output": "native-tool-result",
    "assert_no_synthesized_tool_result": true,
    "assert_declared_tool_binding_only": true,
    "assert_tool_executed_once": true
  }
}
